intent,query
ask_building_location,How do I get to IAEC?
ask_building_location,Can you show me the location of IAEC on a map?
ask_building_location,What are the directions to IAEC building?
ask_building_location,Where is IAEC Building located?
ask_building_location,Can you give me directions to IAEC Building?
ask_building_location,"I am lost, how do I get to IAEC Building?"
ask_building_location,What are the coordinates of IAEC Building?
ask_building_location,Where is the IAEc building located?
ask_building_location,Can you tell me how to get to the IAEc building?
ask_building_location,I'm looking for directions to the IAEc building.
ask_building_location,What are the coordinates of the IAEc building?
ask_building_location,Where is the Main Building located on campus?
ask_building_location,Can you direct me to the Science Building?
ask_building_location,How do I get to the Engineering Building?
ask_building_location,What are the directions to the University Hall?
ask_building_location,Where is the library located in school?
ask_building_location,Can you tell me where the student union is located in hotel?
ask_building_location,How do I get to the cafeteria from school building?
ask_building_location,What's the address of the lecture hall in hotel building?
ask_building_location,Where is the location of Grand Hotel?
ask_building_location,"Can you tell me the address of the hotel, The Ritz-Carlton?"
ask_building_location,I am looking for the location of the building where Ibis Hotel is situated.
ask_building_location,What are the directions to get to Sofitel Singapore Sentosa Resort & Spa?
ask_building_include,Does the library have a building B1?
ask_building_include,Is the computer lab located in building B1?
ask_building_include,What floor is the cafeteria on in building B1?
ask_building_include,Can I find the staff room in building B1?
ask_building_include,Does the university library include building B1?
ask_building_include,Is building B1 included in the university campus?
ask_building_include,What buildings are included in the B1 complex?
ask_building_include,Are there any other buildings besides B1 that are part of the university?
ask_building_include,Is the lecture hall in building A3?
ask_building_include,What are the facilities available in building A3?
ask_building_include,Where is the library located in building A3?
ask_building_include,Are there any elevators in building A3?
ask_building_include,What buildings does the university library include?
ask_building_include,Does the admin building have any other facilities inside it?
ask_building_include,Is the library building included in the campus?
ask_building_include,Does the student center building include any libraries?
ask_building_include,What are the buildings included in LY zone?
ask_building_include,Can you give me a list of all the buildings in LY zone?
ask_building_include,"I am looking for the names of some buildings within LY zone, can you tell me?"
ask_building_include,Which are the different types of buildings available in LY zone?
ask_building_include,Which buildings include Block D in their address?
ask_building_include,Are there any locations with Block D as part of their building name?
ask_building_include,Is block D included in campus?
ask_building_include,Does block D exist on campus?
ask_building_include,Can I find block D at this university?
ask_building_include,Is building D part of our campus?
ask_building_include,Where is D Block located on campus?
ask_building_include,Can you show me where D Block building is?
ask_building_include,How do I get to D Block?
ask_building_include,What's the address of D Block building?
ask_building_include,Is D Zone building included in campus?
ask_building_include,Does the university's map include D Zone building?
ask_building_include,Can I find D Zone building on the campus directory?
ask_building_include,Is D Zone a part of the university buildings?
ask_building_include,Does the library building include D-zone?
ask_building_include,Is there a D-zone in the university's main library building?
ask_building_include,Can I find D-zone in the university's library?
ask_building_include,Will D-zone be included in the new library building?
ask_building_include,What buildings are in D Block?
ask_building_include,Is D Block a single building or multiple?
ask_building_include,Can you list all buildings present in D Block?
ask_building_include,Are there any other buildings similar to D Block?
ask_building_include,What buildings are in XMUM IAEC?
ask_building_include,Can you tell me about the facilities in XMUM IAEC?
ask_building_include,Which blocks are included in XMUM IAEC campus?
ask_building_include,Are there any new buildings added to XMUM IAEC?
ask_building_include,Does IAEC building have a library?
ask_building_include,Is the IAEC building fully air-conditioned?
ask_building_include,Can I find the cafeteria in IAEC building?
ask_building_include,Are there any sports facilities inside IAEC building?
ask_building_include,What facilities are available in IAEC Building?
ask_building_include,Can you tell me about IAEC Building?
ask_building_include,"I am looking for a place to study, is IAEC Building suitable?"
ask_building_include,Are there any recreational areas in IAEC Building?
ask_building_include,What buildings are included in IAEc?
ask_building_include,Can you give me a list of buildings in IAEc?
ask_building_include,I am looking for a map of IAEc building's location
ask_building_include,Which areas are covered by IAEc building?
ask_building_include,Does IAEC building have a lecture theatre?
ask_building_include,Can you tell me about facilities in IAEC building?
ask_building_include,Does the new school building include a library?
ask_building_include,Is there a hotel with a big building in the area?
ask_handbook_info,What are the birthday cake recommendations in the student handbook?
ask_handbook_info,Can you show me the guidelines for birthday cake ideas from the handbook?
ask_handbook_info,How do I find information about birthday cake suggestions in the university's student handbook?
ask_handbook_info,Where can I read the section on birthday cake ideas and recommendations in the student handbook?
ask_handbook_info,What are the birthday cake recommendation in the handbook?
ask_handbook_info,Can you show me birthday cake ideas from the university handbook?
ask_handbook_info,I need to know the birthday cake suggestions in our university's handbook.
ask_handbook_info,Where can I find birthday cake recommendations in the student handbook?
ask_handbook_info,Where can I find the handbook with cake recipes?
ask_handbook_info,I need information from the handbook on how to make cake.
ask_handbook_info,What is the handbook's content regarding baking a cake?
ask_handbook_info,Can you show me the relevant chapter in the handbook for cakes?
ask_handbook_info,What is the birthday cake policy in our university handbook?
ask_handbook_info,Can you tell me where to find information on birthday cakes in the student handbook?
ask_handbook_info,How do I access the birthday cake related rules and regulations in the handbook?
ask_handbook_info,What are the guidelines for ordering birthday cakes mentioned in the university handbook?
ask_handbook_info,What page is cake shops mentioned in the handbook?
ask_handbook_info,Can you tell me where to find cake shops information in the handbook?
ask_handbook_info,How do I locate the section about cake shops in the handbook?
ask_handbook_info,Is there a specific chapter or section for cake shops in the handbook?
ask_handbook_info,What are the operating hours of On-Campus Clinics?
ask_handbook_info,Where is the handbook for On-Campus Clinics located?
ask_handbook_info,Can I find information about the services offered by On-Campus Clinics in the handbook?
ask_handbook_info,How do I access the handbook for On-Campus Clinics?
ask_handbook_info,Where can I find information about clinic hours in the student handbook?
ask_handbook_info,How to access handbook details regarding healthcare facilities on campus?
ask_handbook_info,Can you direct me to where I can find a list of medical services listed in the university handbook?
ask_handbook_info,What section in the student handbook covers health and wellness services available on campus?
ask_handbook_info,Where can I find information on vaccinations required for students at the campus clinic handbook?
ask_handbook_info,Can you tell me about the medical history form in the campus clinic handbook?
ask_handbook_info,What are the guidelines for using the campus clinic facilities mentioned in the handbook?
ask_handbook_info,Are there any emergency procedures outlined in the campus clinic handbook?
ask_handbook_info,Where can I find the handbook for the Medical Services?
ask_handbook_info,What is included in the Medical Services handbook?
ask_handbook_info,Can I get a copy of the Medical Services handbook online?
ask_handbook_info,How do I access the Medical Services handbook?
ask_handbook_info,What is included in the handbook for mental health clinics?
ask_handbook_info,Can I access the online version of the handbook for our clinic?
ask_handbook_info,What is the purpose of the AskA User Guide:handbook?
ask_handbook_info,Where can I find the latest version of the handbook in the portal?
ask_handbook_info,How often is the handbook updated with new information?
ask_handbook_info,Where can I find the electronic copies of the university handbook?
ask_handbook_info,How do I access the university's student handbook online?
ask_handbook_info,Can you provide me with a link to the digital version of the university handbook?
ask_handbook_info,I need help finding the latest edition of the university student handbook.
ask_handbook_info,What is the syllabus of semester 1 in the handbook?
ask_handbook_info,I need help understanding the course structure in the handbook.
ask_handbook_info,Can you show me where I can find the exam schedule in the handbook?
ask_handbook_info,How do I access the handbook on my mobile?
ask_handbook_info,What is the policy on academic integrity in the university handbook?
ask_handbook_info,How do I access the university's handbook section on student conduct?
ask_handbook_info,Can you provide me with more information about the code of conduct outlined in the student handbook?
ask_handbook_info,Where can I find details about attendance policies in the university's online handbook?
ask_handbook_info,What is the handbook policy on report issues?
ask_handbook_info,How do I submit a report issue in the handbook?
ask_handbook_info,Can you provide information on handling report issues according to the handbook?
ask_handbook_info,Where can I find the guidelines for reporting issues in the university handbook?
ask_handbook_info,What is the handbook for cashless payment on campus?
ask_handbook_info,"I am unable to find the guide for contactless payments, where can I get it from?"
ask_handbook_info,How do I access the cashless payment policy handbook online?
ask_handbook_info,Can anyone share a digital copy of the student handbook on contactless transactions?
ask_handbook_info,Where can I find the handbook about cashless payment guides?
ask_handbook_info,What is the location of the cashless payment guide handbook?
ask_handbook_info,How do I get a copy of the cashless payment guide handbook?
ask_handbook_info,Can you provide me with information on the cashless payment guide handbook?
ask_handbook_info,What are the accepted payment methods for the handbook?
ask_handbook_info,Can I pay for the handbook online or in-person?
ask_handbook_info,What are the payment options available in the student handbook?
ask_handbook_info,How can I pay my fees as per the university rules mentioned in the handbook?
ask_handbook_info,Can you provide information on payment methods described in the student handbook?
ask_handbook_info,What are the accepted payment modes according to the university's handbook for students?
ask_handbook_info,What is the handbook information about ePayment?
ask_handbook_info,How can I access the ePayment handbook?
ask_handbook_info,Where can I find more details on the university's ePayment handbook?
ask_handbook_info,Can you provide me with a link to the ePayment handbook?
ask_handbook_info,What is the handbook policy on mental health support?
ask_handbook_info,Can you provide information about the fitness center in the student handbook?
ask_handbook_info,How does the university support students with physical disabilities according to its handbook?
ask_handbook_info,Where can I find more details about the counseling services in the student handbook?
ask_handbook_info,What is the tuition fee for Health and Wellness Services in the handbook?
ask_handbook_info,Can you please provide me with information about the handbook on Health and Wellness Services at our university?
ask_handbook_info,How do I access the Health and Wellness Services handbook online?
ask_handbook_info,Are there any additional fees for Health and Wellness Services mentioned in the student handbook?
ask_handbook_info,What information can I find in the handbook of counselling centre?
ask_handbook_info,How to access the handbook of counselling centre?
ask_handbook_info,Is the handbook of counselling centre available online?
ask_handbook_info,Where can I collect a physical copy of the handbook for counselling centre?
ask_handbook_info,What is the content of the university handbook on wellness?
ask_handbook_info,Where can I find information about the university's wellness policies in the handbook?
ask_handbook_info,Can you provide me with a summary of the wellness section in the university handbook?
ask_handbook_info,How do I access the wellness guidelines outlined in the university handbook?
ask_handbook_info,Where can I find the handbook on mental health resources?
ask_handbook_info,What is included in the university's mental health handbook?
ask_handbook_info,Can you provide me with a link to the mental health handbook?
ask_handbook_info,How do I access the university's mental health information handbook?
ask_handbook_info,Where can I find information on booking a study room at the library?
ask_handbook_info,What are the rules for using the study rooms in the university library handbook?
ask_handbook_info,Can you provide me with the handbook guidelines for reserving a study room in the library?
ask_handbook_info,How do I access the library's study room booking policy from the handbook?
ask_handbook_info,What are the rules for booking a library study room?
ask_handbook_info,How do I book a study room in the university library?
ask_handbook_info,Can you provide information on library study room bookings from the handbook?
ask_handbook_info,What is the process to reserve a library study room according to the university handbook?
ask_handbook_info,What pages in the handbook discuss study rooms?
ask_handbook_info,Where can I find information about using a study room from the campus handbook?
ask_handbook_info,How do I access the study room policy in the student handbook?
ask_handbook_info,Can you show me where in the handbook it talks about study room booking?
ask_handbook_info,What page is the study room handbook on?
ask_handbook_info,Where can I find the study room handbook?
ask_handbook_info,Can you give me information about the study room handbook?
ask_handbook_info,Is the study room handbook available online?
ask_handbook_info,What is the page number of library booking in handbook?
ask_handbook_info,How do I access library booking section in handbook?
ask_handbook_info,Can you tell me where to find library booking information in handbook?
ask_handbook_info,What should I look for when searching for library booking details in handbook?
ask_handbook_info,What is the location of KTV Near XMUM:handbook?
ask_handbook_info,How to get to KTV Near XMUM:handbook from university campus?
ask_handbook_info,Is there a map available for KTV Near XMUM:handbook in the handbook?
ask_handbook_info,Where can I find more information about KTV Near XMUM:handbook's facilities?
ask_handbook_info,What page number can I find KTV near Xiamen University's handbook?
ask_handbook_info,Where is the location of KTV near XMUM mentioned in the university's handbook?
ask_handbook_info,"I'm looking for the location of KTV near XMUM in the university handbook, what are the exact coordinates?"
ask_handbook_info,Can you please tell me where KTV near XMUM is located according to the Xiamen University handbook?
ask_handbook_info,Where can I find the handbook for the karaoke machine?
ask_handbook_info,I need to know more about the settings on the karaoke's user guide.
ask_handbook_info,Can someone tell me where the karaoke user manual is located?
ask_handbook_info,What information does the karaoke's owner's handbook provide?
ask_handbook_info,where can I find the handbook for KTV?
ask_handbook_info,"I need to know more about the KTV handbook, where is it?"
ask_handbook_info,what's the best place to get a copy of the KTV handbook?
ask_handbook_info,how do I access the KTV handbook?
ask_handbook_info,Where can I find information about the course syllabus in the Singing Handbook?
ask_handbook_info,What are the contact details to reach out to the authors of the Singing Handbook?
ask_handbook_info,Can you provide me with a summary of the chapter on vocal techniques from the Singing Handbook?
ask_handbook_info,How do I access the online version of the Singing Handbook for my course?
ask_handbook_info,Where can I find the handbook on bicycle parking facilities?
ask_handbook_info,What is the address of the handbook for bike parking?
ask_handbook_info,How do I get a copy of the bicycle parking guide?
ask_handbook_info,Can you provide me with information about the location of the handbook for bicycle parking?
ask_handbook_info,Where can I find the handbook on bicycle parking in campus?
ask_handbook_info,How to locate the bicycle parking area using the handbook?
ask_handbook_info,What are the rules for locking my bike as per the handbook on bicycle parking?
ask_handbook_info,Can you show me where it is mentioned in the handbook about not parking bicycles under trees?
ask_handbook_info,What are the rules for bike parking in the handbook?
ask_handbook_info,Can I find information about bike parking policies in the student handbook?
ask_handbook_info,Where can I locate the section on bike parking in the campus handbook?
ask_handbook_info,How does the university handle bike parking according to its handbook?
ask_handbook_info,Where can I find information about bicycle parking in the handbook?
ask_handbook_info,What are the guidelines for bicycle parking as per the university's handbook?
ask_handbook_info,Can you provide me with a page number where bicycle parking rules are mentioned in the student handbook?
ask_handbook_info,How do I access the information related to bicycle parking from the university's student handbook?
ask_handbook_info,What page in the handbook explains parking rules?
ask_handbook_info,Can you tell me how to find information on bike parking in the student handbook?
ask_handbook_info,Is there a section in the campus handbook that outlines policies for locking up my bicycle?
ask_handbook_info,"I couldn't find where the handbook mentions safe bike storage, can someone help me?"
ask_handbook_info,What are the operating hours of Milk Tea Shops Near XMUM:handbook?
ask_handbook_info,Can I get a map to find Milk Tea Shops Near XMUM:handbook on campus?
ask_handbook_info,Are there any deals or discounts at Milk Tea Shops Near XMUM:handbook?
ask_handbook_info,How do I contact Milk Tea Shops Near XMUM:handbook for catering services?
ask_handbook_info,What are the contact details of handbook milk tea shops around XMU?
ask_handbook_info,Can you give me a list of handbook milk tea shops in XMU that I can refer to?
ask_handbook_info,Where can I find handbook milk tea shops near XMU campus?
ask_handbook_info,Are there any recommended handbook milk tea shops near XMU?
ask_handbook_info,What is the recipe for making milk tea in the handbook?
ask_handbook_info,Can you tell me how to make milk tea according to the handbook's instructions?
ask_handbook_info,I need help with finding the milk tea recipe in our university's handbook.
ask_handbook_info,How do I access the handbook's information on brewing perfect milk tea?
ask_handbook_info,Where can I find information about bubble tea in the student handbook?
ask_handbook_info,How to access the section about bubble tea in the university handbook?
ask_handbook_info,What page does it say about bubble tea policies in the student handbook online?
ask_handbook_info,Can you show me where to find details on bubble tea rules in the handbook?
ask_handbook_info,What is the table of contents for the handbook on soft drinks?
ask_handbook_info,Can you provide me with information about the handbook on juices?
ask_handbook_info,Where can I find the index of the handbook on beverages?
ask_handbook_info,What topics are covered in the handbook on energy drinks?
ask_handbook_info,What is the information about lecture theatres in XMUM handbook?
ask_handbook_info,Can you provide me with details on tutorial rooms mentioned in XMUM handbook?
ask_handbook_info,How can I find out more about lecture halls from XMUM's latest handbook?
ask_handbook_info,Are there any specific sections or pages for seminar rooms in the new XMUM handbook?
ask_handbook_info,What are the lecture rooms in xmum:handbook?
ask_handbook_info,Can you show me the tutorial rooms available on xmum:handbook?
ask_handbook_info,"I am looking for labs in xmum:handbook, where can I find them?"
ask_handbook_info,Are there any discussion rooms listed in xmum:handbook?
ask_handbook_info,What is the contact information of the student handbook?
ask_handbook_info,Can I find the handbook online or in-person?
ask_handbook_info,How do I get a copy of the course catalog from the student handbook?
ask_handbook_info,Is there an index of important dates and deadlines in the university's official handbook?
ask_handbook_info,What is the format of the lecture handouts?
ask_handbook_info,Where can I find the latest handbook information on lectures?
ask_handbook_info,How do I access the lecture handbook online?
ask_handbook_info,Can you provide me with more details about the lecture guidelines in the handbook?
ask_handbook_info,What is the syllabus of tutorial:handbook for this semester?
ask_handbook_info,Can you provide me with a detailed outline of tutorial:handbook?
ask_handbook_info,Where can I find the tutorial:handbook notes online?
ask_handbook_info,Are there any video lectures available for tutorial:handbook?
ask_handbook_info,Where can I find the laboratory handbook?
ask_handbook_info,What is the location of the laboratory handbook?
ask_handbook_info,How do I access the laboratory handbook?
ask_handbook_info,Can you provide me with information about the laboratory handbook?
ask_handbook_info,What does it say about searching books in the library handbook?
ask_handbook_info,Can you tell me where I can find information on finding books in the library's handbook?
ask_handbook_info,I need help understanding how to search for books in the library from the handbook. Can someone explain it to me?
ask_handbook_info,What section of the library's handbook explains how to locate a specific book?
ask_handbook_info,What is the title of handbook available in library?
ask_handbook_info,Can I find handbook on self study in library online catalog?
ask_handbook_info,Are there any handbooks related to programming available for borrowing in university library?
ask_handbook_info,How many handbooks about mathematics are available for reading at the library?
ask_handbook_info,Where can I get a copy of the university handbook?
ask_handbook_info,What are the different sections in the university handbook?
ask_handbook_info,Where can I find information about library opening hours in the handbook?
ask_handbook_info,How do I access library search:handbook to check book availability?
ask_handbook_info,Can you tell me where to look for library events and activities in the handbook?
ask_handbook_info,What is the best way to navigate the handbook section for searching library resources?
ask_handbook_info,Where can I find the undergraduate handbook?
ask_handbook_info,What is the tuition fee information in the postgraduate handbook?
ask_handbook_info,How do I access the handbook for distance learning students?
ask_handbook_info,Can you provide me with a link to the faculty handbook?
ask_handbook_info,What is included in the library handbook?
ask_handbook_info,How do I access the library's guide on finding books?
ask_handbook_info,Can you provide me with a link to the library handbook for locating resources?
ask_handbook_info,What are the step-by-step instructions for finding books according to the library handbook?
ask_handbook_info,Where can I find the student handbook at the library?
ask_handbook_info,How do I access the university handbook in the library?
ask_handbook_info,Can you show me where to get a copy of the student handbook book from the library?
ask_handbook_info,What section in the library has the university handbook?
ask_handbook_info,Where is the handbook section in the library?
ask_handbook_info,Can you show me where to find handbooks on the bookshelf?
ask_handbook_info,"I'm looking for a specific handbook, can someone help me locate it on the shelf?"
ask_handbook_info,How do I access the collection of handbooks in the campus library?
ask_handbook_info,Where can I find the library's online handbook?
ask_handbook_info,What is the link to access the university handbook?
ask_handbook_info,How do I navigate to the library handbook on the university portal?
ask_handbook_info,Can you provide me with a physical copy of the library handbook?
ask_handbook_info,What is the process of printing from computer at library?
