intent,query
ask_restaurant_recommendation,Where can I find a restaurant with food as delicious as Penangfengwei:restaurant?
ask_restaurant_recommendation,What is a good restaurant in Penang to try some local dishes?
ask_restaurant_recommendation,Can you recommend a restaurant near me that serves authentic Malaysian cuisine?
ask_restaurant_recommendation,What's a good restaurant like Penang Feng Wei in this area?
ask_restaurant_recommendation,Can anyone recommend Penang Feng Wei or similar restaurants around here?
ask_restaurant_recommendation,Where can I find food like Penang Feng Wei near my location?
ask_restaurant_recommendation,Do you have any recommendations for restaurants similar to Penang Feng Wei?
ask_restaurant_recommendation,What are some good restaurants in Penang?
ask_restaurant_recommendation,Can you recommend a restaurant like 槟城风味 near me?
ask_restaurant_recommendation,Can you recommend any good restaurants in Jiaweishixuan?
ask_restaurant_recommendation,What's a popular restaurant to dine at in Jiaweishixuan area?
ask_restaurant_recommendation,Are there any Michelin-starred restaurants near Jiaweishixuan that I can try?
ask_restaurant_recommendation,Where are some of the top-rated restaurants located around Jiaweishixuan?
ask_restaurant_recommendation,What kind of food does Jiawei Shixuan serve?
ask_restaurant_recommendation,Is Jiawei Shixuan a good place to eat?
ask_restaurant_recommendation,Can you recommend some dishes from Jiawei Shixuan menu?
ask_restaurant_recommendation,How is the overall dining experience at Jiawei Shixuan?
ask_restaurant_recommendation,What kind of food does Jia Wei Shi Xuan serve?
ask_restaurant_recommendation,Is Jia Wei Shi Xuan a good place to eat in this area?
ask_restaurant_recommendation,Can you recommend any Chinese restaurants like Jia Wei Shi Xuan?
ask_restaurant_recommendation,Where can I find authentic Cantonese dishes near Jia Wei Shi Xuan?
ask_restaurant_recommendation,What's a good Chinese restaurant near me?
ask_restaurant_recommendation,Can you recommend a place to eat in KL that serves good roast meat?
ask_restaurant_recommendation,Where can I find a dim sum restaurant with high ratings?
ask_restaurant_recommendation,Are there any authentic Szechuan restaurants around here?
ask_restaurant_recommendation,What's a good place to eat like Chinese Muslim Xiaochao in the city?
ask_restaurant_recommendation,Can you recommend some restaurants similar to Chinese Muslim Xiaochao?
ask_restaurant_recommendation,"I'm craving for food like Chinese Muslim Xiaochao, do you have any recommendations?"
ask_restaurant_recommendation,Where can I find a restaurant that serves similar dishes to Chinese Muslim Xiaochao?
ask_restaurant_recommendation,What kind of Chinese Muslim food can I find at Xiaochao?
ask_restaurant_recommendation,Is Xiaochao a good place to try authentic Chinese Muslim cuisine?
ask_restaurant_recommendation,Can you recommend any must-try dishes when dining at Xiaochao restaurant?
ask_restaurant_recommendation,How does Xiaochao compare to other Chinese Muslim restaurants in terms of flavor and quality?
ask_restaurant_recommendation,What kind of dishes does Muslim Xiaochao serve?
ask_restaurant_recommendation,Can you recommend any good restaurants like Muslim Xiaochao in this area?
ask_restaurant_recommendation,Is Muslim Xiaochao a nice place to eat with family?
ask_restaurant_recommendation,Are there any similar restaurants to Muslim Xiaochao nearby?
ask_restaurant_recommendation,Can you recommend any good Chinese food in town?
ask_restaurant_recommendation,What's your top pick for Muslim-owned restaurants in town?
ask_restaurant_recommendation,What kind of food does Uni Hotpot serve?
ask_restaurant_recommendation,Is Uni Hotpot a good restaurant?
ask_restaurant_recommendation,Can you recommend Uni Hotpot or its nearby alternatives?
ask_restaurant_recommendation,How is the dining experience at Uni Hotpot?
ask_restaurant_recommendation,What are some good restaurants like Hot Pot near Uni?
ask_restaurant_recommendation,Can you recommend a hot pot place around Uni?
ask_restaurant_recommendation,Where can I find a hot pot restaurant similar to Uni Hot Pot?
ask_restaurant_recommendation,What's the best hot pot eatery near University?
ask_restaurant_recommendation,What's good to eat at Uni Hot Pot?
ask_restaurant_recommendation,Can you recommend something at Uni Hot Pot?
ask_restaurant_recommendation,Is Uni Hot Pot a good restaurant for foodies?
ask_restaurant_recommendation,What kind of dishes does Uni Hot Pot serve?
ask_restaurant_recommendation,What's a good restaurant like 有你香锅?
ask_restaurant_recommendation,"I'm looking for restaurants similar to 有你香锅, do you have any recommendations?"
ask_restaurant_recommendation,Can you recommend some other dishes like 有你香锅?
ask_restaurant_recommendation,Where can I find a restaurant with a similar menu to 有你香锅?
ask_restaurant_recommendation,What's a good coffee place near me?
ask_restaurant_recommendation,"I'm looking for a cozy cafe with great coffee, do you recommend ZUS Coffee?"
ask_restaurant_recommendation,Where can I find the best coffee in town?
ask_restaurant_recommendation,Are there any good coffee shops like ZUS Coffee around?
ask_restaurant_recommendation,Where can I find good food like Zus Coffee nearby?
ask_restaurant_recommendation,What's a popular restaurant near Zus Coffee that serves similar cuisine?
ask_restaurant_recommendation,Can you recommend some restaurants around Zus Coffee area?
ask_restaurant_recommendation,Is there any nice eatery near Zus Coffee?
ask_restaurant_recommendation,What are some popular dishes at ZUS restaurant?
ask_restaurant_recommendation,Is ZUS restaurant good?
ask_restaurant_recommendation,Can you recommend something to eat at ZUS?
ask_restaurant_recommendation,What kind of cuisine does ZUS restaurant serve?
ask_restaurant_recommendation,What is the most recommended restaurant in town?
ask_restaurant_recommendation,Can you suggest some popular restaurants nearby?
ask_restaurant_recommendation,Where can I find a good place to eat around here?
ask_restaurant_recommendation,Which restaurant do you recommend for dinner tonight?
ask_restaurant_recommendation,What kind of food does Lakefront Cafe serve?
ask_restaurant_recommendation,"I'm in the mood for something fancy, where can I find Lakefront Cafe?"
ask_restaurant_recommendation,Can you recommend a good place to eat like Lakefront Cafe around here?
ask_restaurant_recommendation,Where is the best restaurant near me like Lakefront Cafe?
ask_restaurant_recommendation,What kind of food does Lakefront Cafe serve?
ask_restaurant_recommendation,Is Lakefront Cafe a good place to eat?
ask_restaurant_recommendation,Can you recommend any restaurants like Lakefront Cafe?
ask_restaurant_recommendation,What's the atmosphere like at Lakefront Cafe?
ask_restaurant_recommendation,Where should I eat near Lakefront Restaurant?
ask_restaurant_recommendation,What's a good restaurant to dine in Lakefront?
ask_restaurant_recommendation,Can you recommend any restaurants around Lakefront?
ask_restaurant_recommendation,Is there a nice restaurant within walking distance of Lakefront?
ask_restaurant_recommendation,What's a good restaurant near Lake Front Cafe?
ask_restaurant_recommendation,Can you recommend any restaurants similar to Lake Front Cafe?
ask_restaurant_recommendation,Where can I get food like Lake Front Cafe around here?
ask_restaurant_recommendation,Is Lake Front Cafe the only good restaurant in this area?
ask_restaurant_recommendation,"Where can I find a good coffee near me, something like Cotti Coffee?"
ask_restaurant_recommendation,"Do you have any recommendations for the best coffee shops in town, including Cotti Coffee?"
ask_restaurant_recommendation,"Can you suggest some popular restaurants with great coffee, such as Cotti Coffee?"
ask_restaurant_recommendation,Are there any coffee places similar to Cotti Coffee that I can try?
ask_restaurant_recommendation,What's good to eat at Cotti Coffee?
ask_restaurant_recommendation,Can you recommend any dishes from Cotti Coffee menu?
ask_restaurant_recommendation,How is the food quality at Cotti Coffee?
ask_restaurant_recommendation,Are there any must-try items at Cotti Coffee?
ask_restaurant_recommendation,What type of food does Cotti serve?
ask_restaurant_recommendation,Is Cotti a good place to eat?
ask_restaurant_recommendation,Can you recommend any Italian restaurants like Cotti?
ask_restaurant_recommendation,"I'm looking for a restaurant with a similar menu to Cotti, do you have any suggestions?"
ask_restaurant_recommendation,What type of cuisine does Cotti serve?
ask_restaurant_recommendation,Can you recommend a good restaurant like Cotti?
ask_restaurant_recommendation,"I love Cotti's food, what other restaurants are similar?"
ask_restaurant_recommendation,What is the recommended time to visit Cotti for dinner?
ask_restaurant_recommendation,What type of cuisine does Bo Ya Xuan Restaurant serve?
ask_restaurant_recommendation,Is Bo Ya Xuan Restaurant open for lunch or dinner?
ask_restaurant_recommendation,Can you recommend Bo Ya Xuan Restaurant for a date night?
ask_restaurant_recommendation,Are there any promotions available at Bo Ya Xuan Restaurant this weekend?
ask_restaurant_recommendation,What kind of dishes does Bo Ya Xuan serve?
ask_restaurant_recommendation,Is Bo Ya Xuan a good place to eat?
ask_restaurant_recommendation,Can you recommend any Chinese food places like Bo Ya Xuan?
ask_restaurant_recommendation,How is the food quality at Bo Ya Xuan?
ask_restaurant_recommendation,What's good about Bo Ya Xuan?
ask_restaurant_recommendation,Can you recommend a dish from Bo Ya Xuan menu?
ask_restaurant_recommendation,How is the food quality at Bo Ya Xuan restaurant?
ask_restaurant_recommendation,Do you have any recommendations for Bo Ya Xuan?
ask_restaurant_recommendation,What kind of food does 博雅轩 serve?
ask_restaurant_recommendation,Is 博雅轩 a good restaurant to eat at?
ask_restaurant_recommendation,Can you recommend any restaurants like 博雅轩?
ask_restaurant_recommendation,Where can I find more information about 博雅轩's menu?
ask_restaurant_recommendation,What's good at SOI 55 THAI KITCHEN?
ask_restaurant_recommendation,Is SOI 55 THAI KITCHEN a recommended spot for Thai food?
ask_restaurant_recommendation,What is good at Soi 55 Thai Kitchen?
ask_restaurant_recommendation,Can anyone recommend dishes from Soi 55 Thai Kitchen?
ask_restaurant_recommendation,How's the food quality of Soi 55 Thai Kitchen?
ask_restaurant_recommendation,Are there any popular dishes to order from Soi 55 Thai Kitchen?
ask_restaurant_recommendation,What's a good restaurant like in Pattaya?
ask_restaurant_recommendation,Can you recommend a nice place to eat near Walking Street Pattaya?
ask_restaurant_recommendation,Which restaurants are popular among tourists in Pattaya?
ask_restaurant_recommendation,Can you suggest some local eateries that serve delicious food in Pattaya?
ask_restaurant_recommendation,What's good to order at Thai Kitchen?
ask_restaurant_recommendation,Can you recommend some dishes from Thai Kitchen?
ask_restaurant_recommendation,"I'm craving something spicy, do you have any recommendations from Thai Kitchen?"
ask_restaurant_recommendation,What's the popular dish of Thai Kitchen?
ask_restaurant_recommendation,What's good to order at Starbucks?
ask_restaurant_recommendation,Can you recommend a drink at Starbucks?
ask_restaurant_recommendation,What are some popular items on the menu at Starbucks?
ask_restaurant_recommendation,Is there anything unique that you can get at Starbucks?
ask_restaurant_recommendation,What is the nearest Starbucks to my location?
ask_restaurant_recommendation,Can you recommend a good Starbucks nearby?
ask_restaurant_recommendation,Is there any Starbucks restaurant in this area?
ask_restaurant_recommendation,Do you have any recommendations for Starbucks places near me?
ask_restaurant_recommendation,What is the popular item at STARBUCKS?
ask_restaurant_recommendation,Is STARBUCKS a good place to eat?
ask_restaurant_recommendation,Can you recommend STARBUCKS for lunch?
ask_restaurant_recommendation,Do people like the food at STARBUCKS?
ask_restaurant_recommendation,What kind of food does Starbucks serve?
ask_restaurant_recommendation,Is Starbucks a good place to eat?
ask_restaurant_recommendation,Can you recommend any restaurants like Starbucks?
ask_restaurant_recommendation,Where is the nearest Starbucks location?
ask_facility_location,Where is the ATM in B1 Supermarket?
ask_facility_location,Can I find a bookstore near B1 Supermarket?
ask_facility_location,What are the directions to the pharmacy in B1 Supermarket?
ask_facility_location,Is there a food court located inside B1 Supermarket?
ask_facility_location,Where is the car park in B1 Super Market?
ask_facility_location,How to get to the ATM machine in B1 Super Market?
ask_facility_location,Which direction is the food court from B1 Super Market:facility?
ask_facility_location,Can you show me where the lift is located in B1 Super Market?
ask_facility_location,Where is B1 Dining Area located?
ask_facility_location,Can you show me the way to B1 Dining Area?
ask_facility_location,"I'm looking for B1 Dining Area, how do I get there?"
ask_facility_location,What are the directions to B1 Dining Area?
ask_facility_location,Where is the location of B1 Dining?
ask_facility_location,Can I find B1 Dining on campus?
ask_facility_location,Where is the ATM located on campus?
ask_facility_location,Can you tell me the location of an ATM near the library?
ask_facility_location,Where is the cash machine located in the library?
ask_facility_location,Can you direct me to a cash machine on campus?
ask_facility_location,How do I find the nearest cash machine?
ask_facility_location,Is there a cash machine available near the student union building?
ask_facility_location,Where is the nearest IELTS Centre?
ask_facility_location,Can you tell me the location of IELTS Centre on campus?
ask_facility_location,How do I get to IELTS Centre from here?
ask_facility_location,What are the directions to IELTS Centre?
ask_facility_location,Where is the Yoga Room located on campus?
ask_facility_location,Can you direct me to the Yoga Room facility?
ask_facility_location,"I'm looking for the Yoga Room, where is it?"
ask_facility_location,How do I get to the Yoga Room facility?
ask_facility_location,Where is Yoga Flow located?
ask_facility_location,Can you give me directions to the nearest yoga studio?
ask_facility_location,Where is the TCM Clinic located?
ask_facility_location,Can you show me where TCM Clinic is on the map?
ask_facility_location,How do I get to TCM Clinic from here?
ask_facility_location,What are the directions to TCM Clinic?
ask_facility_location,where is the nearest TCM Clinic?
ask_facility_location,how to get to TCM Clinic from here?
ask_facility_location,Where is the PluxHealth Clinic located?
ask_facility_location,How can I get to PluxHealth Clinic?
ask_facility_location,What are the directions to PluxHealth Clinic?
ask_facility_location,Can you provide me with the location of PluxHealth Clinic?
ask_facility_location,Where is the gym located in PluX Health?
ask_facility_location,How do I get to the swimming pool in PluX Health?
ask_facility_location,What is the address of the library in PluX Health?
ask_facility_location,Can you tell me where the basketball court is at PluX Health?
ask_facility_location,Where is the Repair Office located?
ask_facility_location,Can you tell me how to get to the Repair Office?
ask_facility_location,"I'm trying to find the location of the Repair Office, can someone help me?"
ask_facility_location,How do I get to the facility at Repair Office?
ask_facility_location,Where is the Admissions Office located on campus?
ask_facility_location,Can you tell me how to get to the Admissions Office?
ask_facility_location,"I'm having trouble finding the Admissions Office, can someone help me with directions?"
ask_facility_location,How do I locate the facility for admissions and enrollment?
ask_facility_location,Where is the admission office located on campus?
ask_facility_location,Can you give me directions to the university's admission office?
ask_facility_location,"I'm having trouble finding the admissions office, can someone help me with that?"
ask_facility_location,How do I get to the university facilities including the admission office?
ask_facility_location,Where is the nearest Volleyball Court?
ask_facility_location,How do I get to the Volleyball facility on campus?
ask_facility_location,Where is the volleyball court located on campus?
ask_facility_location,Can you direct me to the volleyball facility?
ask_facility_location,"I'm looking for the location of the sports complex, where's the volleyball court?"
ask_facility_location,What's the address of the volleyball facility on our university grounds?
ask_facility_location,Where is the tennis court located on campus?
ask_facility_location,Can you show me the map to the tennis courts?
ask_facility_location,"I'm looking for the tennis facility, can you tell me where it is?"
ask_facility_location,How do I get to the tennis courts from my dorm?
ask_facility_location,Where is the tennis court located on campus?
ask_facility_location,Can you show me the way to the tennis field?
ask_facility_location,What's the location of the tennis facility?
ask_facility_location,How do I get to the tennis field near the student union?
ask_facility_location,Where is the small football field located on campus?
ask_facility_location,Can you tell me how to get to the small football field?
ask_facility_location,"I'm looking for the location of the small football field, can someone help?"
ask_facility_location,What are the directions to the small football field on our university grounds?
ask_facility_location,Where is the football field located on campus?
ask_facility_location,Can you show me the location of the football facility?
ask_facility_location,How do I get to the football field from the library?
ask_facility_location,What are the directions to the sports facility where the football games are held?
ask_facility_location,Where is the basketball court on campus?
ask_facility_location,How do I get to the nearest basketball facility?
ask_facility_location,Can you tell me the location of the outdoor basketball courts?
ask_facility_location,What are the directions to the basketball arena on campus?
ask_facility_location,Where is the basketball field located on campus?
ask_facility_location,Can you direct me to the basketball facility?
ask_facility_location,How do I get to the sports complex where the basketball field is?
ask_facility_location,What are the directions to the university's basketball court?
ask_facility_location,Where is the basketball court located?
ask_facility_location,How do I get to the soccer field?
ask_facility_location,Where is the entrance of Sports Stadium?
ask_facility_location,How do I get to Sports Stadium's main hall?
ask_facility_location,Can you tell me the location of Sports Stadium on campus?
ask_facility_location,What are the directions to reach Sports Stadium's parking area?
ask_facility_location,Where is the swimming pool facility located?
ask_facility_location,Can you tell me the location of the university's swimming pool?
ask_facility_location,I'm looking for the address of the swimming pool facility on campus.
ask_facility_location,How do I get to the swimming pool facility from my dorm?
ask_facility_location,Where is the pool located on campus?
ask_facility_location,Can you direct me to the swimming pool?
ask_facility_location,"I'm trying to find the facility with a pool, can someone help me?"
ask_facility_location,where is the facility of gym located?
ask_facility_location,can i get directions to gym's location?
ask_facility_location,what is the address of gym's facilities?
ask_facility_location,how do i find the gym facility on campus?
ask_facility_location,Where is the gym located?
ask_facility_location,Can you direct me to the Gymnasium?
ask_facility_location,How do I get to the university's Gymnasium facility?
ask_facility_location,What's the location of the Gymnasium on campus?
ask_facility_location,Where is the infirmary located on campus?
ask_facility_location,How do I get to the infirmary facility?
ask_facility_location,Can you tell me the location of the infirmary building?
ask_facility_location,What are the directions to the infirmary facility?
ask_facility_location,Where is the nearest Medical Centre?
ask_facility_location,I am looking for a Medical Centre near my location.
ask_facility_location,How can I get to the Medical Centre?
ask_facility_location,What are the directions to the nearby Medical Centre?
ask_facility_location,where is the badminton court located on campus?
ask_facility_location,how can i get to the badminton facility?
ask_facility_location,where is the badminton sports facility located?
ask_facility_location,what building houses the badminton court?
ask_facility_location,Where is the Badminton Field located on campus?
ask_facility_location,Can you direct me to the Badminton Field facility?
ask_facility_location,"I'm looking for the Badminton Field, can someone tell me where it's situated?"
ask_facility_location,How do I get to the Badminton Field building?
ask_facility_location,Where is the lecture hall in A1 Teaching Building?
ask_facility_location,Can you direct me to the A1 Teaching Building?
ask_facility_location,"I am looking for the classroom location in A1 Teaching Building, can someone help me?"
ask_facility_location,How do I get to the study area in A1 Teaching Building?
ask_facility_location,Where is the A1 Building located?
ask_facility_location,How do I get to the A1 Building?
ask_facility_location,Can you show me where A1 Building is on the campus map?
ask_facility_location,What are the directions to the A1 Building?
ask_facility_location,Where is the location of A2 Teaching Building?
ask_facility_location,Can you show me where A2 Teaching Building is located?
ask_facility_location,How do I get to A2 Teaching Building on campus?
ask_facility_location,What are the directions to A2 Teaching Building?
ask_facility_location,Where is the A2 Building?
ask_facility_location,Can you show me where the A2 Building is located on campus?
ask_facility_location,Where is the nearest A4 building?
ask_facility_location,I need to find the location of A4 building on campus.
ask_facility_location,Can you tell me where A4 building is located?
ask_facility_location,How do I get to A4 building from here?
ask_facility_location,Where is A5 teaching building located?
ask_facility_location,Can you tell me how to get to A5 teaching building?
ask_facility_location,I'm looking for the location of A5 teaching building on campus.
ask_facility_location,How do I find my way to A5 teaching building?
ask_facility_location,Where is the A5 Building located on campus?
ask_facility_location,Can you show me the location of A5 Building in the university map?
ask_facility_location,"I am looking for A5 Building, where is it situated?"
ask_facility_location,How do I get to A5 Building from the main entrance?
ask_facility_location,Where is the gym located in the library?
ask_facility_location,Can you show me where the computer lab is?
ask_facility_location,I'm looking for the library's map to find the art studio.
ask_facility_location,What are the directions to get to the language learning center?
ask_facility_location,Where is the A3 Library located?
ask_facility_location,Can you show me on the map where A3 Library is?
ask_facility_location,How do I get to A3 Library from here?
ask_facility_location,What are the directions to reach A3 Library?
ask_facility_time,What are the operating hours of B1 Supermarket?
ask_facility_time,How late is B1 Supermarket open on Fridays?
ask_facility_time,When does B1 Supermarket close on weekends?
ask_facility_time,At what time does B1 Supermarket start its operations?
ask_facility_time,What are the opening hours of B1 Super Market facilities?
ask_facility_time,How long is the operating time of B1 Super Market's facilities?
ask_facility_time,When does B1 Super Market open its facilities for customers?
ask_facility_time,Can I use B1 Super Market's facilities during their operational hours?
ask_facility_time,What are the operating hours of B1 Dining Area?
ask_facility_time,When is the B1 Dining Area open?
ask_facility_time,How late does B1 Dining Area stay open?
ask_facility_time,On which days is B1 Dining Area available?
ask_facility_time,What are the operating hours of B1 Dining?
ask_facility_time,When is B1 Dining open?
ask_facility_time,How long does B1 Dining stay open each day?
ask_facility_time,At what time does B1 Dining close?
ask_facility_time,What are the operating hours of the ATM at Library?
ask_facility_time,When does the ATM machine near Canteen open?
ask_facility_time,How late is the ATM facility in Admin Building open today?
ask_facility_time,What time does the campus ATM close?
ask_facility_time,What are the operating hours of the cash machine in the library?
ask_facility_time,When is the ATM available for use in the student centre?
ask_facility_time,How late does the cashpoint machine at the gym stay open?
ask_facility_time,What time does the bank card machine stop working in the dorms?
ask_facility_time,What is the IELTS centre's facility opening time?
ask_facility_time,When does the IELTS office open for facility?
ask_facility_time,Can you tell me when the IELTS office facilities are available?
ask_facility_time,At what time do the IELTS office facilities operate?
ask_facility_time,What are the operating hours of IELTS Centre?
ask_facility_time,When is IELTS Centre open to students?
ask_facility_time,At what time does IELTS Centre accept new registrations?
ask_facility_time,Is IELTS Centre available on weekends?
